AreaID,GreatArea,Area,ConferenceID,Conference,ConferenceDetail,WebSite,ConferenceDates,Location,Order,Deadline,DeadlineTimeZone,DeadlineISO,Status,Detail
1,AI,Artificial intelligence,1,AAAI 2024,Annual AAAI Conference on Artificial Intelligence ,https://aaai.org/aaai-conference/ ,February 20-27,"Vancouver, Canada",1,"08 ago. 2023, 23:59",UTC,2023-08-08 23:59:59,Confirmed,"Deadline: 8 Aug 2023, 23:59 PDT"
1,AI,Artificial intelligence,2,IJCAI 2024,International Joint Conference on Artificial Intelligence,,,,1,"01 jan. 2024, 00:00",GMT-3,2024-01-01 00:00:00,TBD,TBD (probably Jan 2024) 
2,AI,Computer vision,3,CVPR 2024,IEEE/CVF Conference on Computer Vision and Pattern Recognition ,https://cvpr.thecvf.com/Conferences/2024,June 17-21,"Seattle, WA, USA",1,"03 nov. 2023, 23:59",PDT,2023-11-03 23:59:59,Confirmed,"Deadline: 3 Nov 2023, 23:59 PDT"
2,AI,Computer vision,4,ECCV 2024,European Conference on Computer Vision,,,,1,"01 mar. 2024, 00:00",,2024-03-01 00:00:00,TBD,TBD (probably Mar 2024)
2,AI,Computer vision,5,ICCV 2024,International Conference on Computational Vision,https://waset.org/computational-vision-conference-in-february-2024-in-lisbon,"February 08-09, 2024","Lisbon, Portugal",1,"29 jun. 2023, 23:59",,2023-06-29 23:59:59,Confirmed,Deadline: 29 Jun 2023
3,AI,Machine learning,6,ICLR 2024,International Conference on Learning Representations,https://waset.org/learning-representations-conference-in-october-2024-in-lisbon,October 28-29 ,"Lisbon, Portugal",1,"31 jul. 2023, 23:59",,2023-07-31 23:59:59,Confirmed,Deadline: 31 Jul 2023
3,AI,Machine learning,7,ICML 2024,International Conference on Machine Learning,,,,1,"01 jan. 2024, 23:59",,2024-01-01 23:59:59,TBD,TBD (probably Jan 2024)
3,AI,Machine learning,8,NeurIPS 2024,Conference on Neural Information Processing Systems,,,,1,"01 mai. 2024, 23:59",,2024-05-01 23:59:59,TBD,TBD (probably May 2024)
3,AI,Machine learning,9,KDD 2024,International Conference on Knowledge Discovery and Data Mining,https://waset.org/knowledge-discovery-and-data-mining-conference-in-october-2024-in-paris,"October 28-29, 2024","Paris, France",1,"31 jul. 2023, 23:59",,2023-07-31 23:59:59,Confirmed,Deadline: 31 Jul 2023
4,AI,Natural language processing,10,ACL 2024,Annual Meeting of the Association for Computational Linguistics,,,,1,"01 jan. 2024, 23:59",,2024-01-01 23:59:59,TBD,TBD (probably Jan 2024)
4,AI,Natural language processing,11,EMNLP 2024,Conference on Empirical Methods in Natural Language Processing,,,,1,"01 jun. 2024, 23:59",,2024-06-01 23:59:59,TBD,TBD (probably Jun 2024)
5,AI,The Web & information retrieval,13,SIGIR 2024,International ACM SIGIR Conference on Research and Development in Information Retrieval,,,,1,"01 jun. 2024, 23:59",,2024-06-01 23:59:59,TBD,TBD (probably Jun 2024)
5,AI,The Web & information retrieval,14,WWW 2024,ACM Web Conference,https://www2024.thewebconf.org,May 13-17,Singapore,1,"05 out. 2023, 23:59",,2023-10-05 23:59:59,Confirmed,Deadline: 5 Oct 2023
6,Systems,Computer architecture,15,ASPLOS 2024,ACM International Conference on Architectural Support for Programming Languages and Operating Systems,https://www.asplos-conference.org/asplos2024/,"April 27-May 1, 2024","San Diego, CA, USA",1,"13 abr. 2023, 15:00",EST,2023-04-13 15:00:00,Confirmed,"Deadline (1 / 2): 13 Apr 2023, 3:00 pm EST"
6,Systems,Computer architecture,15,ASPLOS 2024,ACM International Conference on Architectural Support for Programming Languages and Operating Systems,https://www.asplos-conference.org/asplos2024/,"April 27-May 1, 2024","San Diego, CA, USA",2,"03 ago. 2023, 15:00",EST,2023-08-03 15:00:00,Confirmed,"Deadline (2 / 2): 3 Aug 2023, 3:00 pm EST"
6,Systems,Computer architecture,15,ASPLOS 2024,ACM International Conference on Architectural Support for Programming Languages and Operating Systems,https://www.asplos-conference.org/asplos2024/,"April 27-May 1, 2024","San Diego, CA, USA",3,"23 nov. 2023, 15:00",EST,2023-11-23 15:00:00,Confirmed,"Deadline (3 / 3): 23 Nov 2023, 3:00 pm EST"
6,Systems,Computer architecture,16,ISCA 2024,International Symposium on Computer Architecture (ISCA),,,,1,"01 nov. 2023, 23:59",,2023-11-01 23:59:59,TBD,TBD (probably Nov 2023)
6,Systems,Computer architecture,17,MICRO 2024,IEEE/ACM International Symposium on Microarchitecture,,,,1,"01 abr. 2024, 23:59",,2024-04-01 23:59:59,TBD,TBD (probably Apr 2024)
7,Systems,Computer networks,18,SIGCOMM 2024,ACM Special Interest Group on Data Communication (SIGCOMM),,,,1,"01 jan. 2024, 23:59",,2024-01-01 23:59:59,TBD,TBD (probably Jan 2024)
7,Systems,Computer networks,19,NSDI 2024,USENIX Symposium on Networked Systems Design and Implementation,https://www.usenix.org/conference/nsdi24,"April 16–18, 2024","Santa Clara, CA, USA",1,"27 abr. 2023, 20:59",,2023-04-27 20:59:59,Confirmed,"Deadline (1 / 2): 27 Apr 2023, 8:59:59 pm"
7,Systems,Computer networks,19,NSDI 2024,USENIX Symposium on Networked Systems Design and Implementation,https://www.usenix.org/conference/nsdi24,"April 16–18, 2024","Santa Clara, CA, USA",2,"07 set. 2023, 20:59",,2023-09-07 20:59:59,Confirmed,"Deadline (2 / 2): 7 Sep 2023, 8:59:59 pm"
8,Systems,Computer security,20,CCS 2024,ACM Conference on Computer and Communications Security,,,,1,"01 jan. 2024, 23:59",,2024-01-01 23:59:59,TBD,TBD (probably Jan 2024)
8,Systems,Computer security,20,CCS 2024,ACM Conference on Computer and Communications Security,,,,2,"01 mai. 2024, 23:59",,2024-05-01 23:59:59,TBD,TBD (probably May 2024)
8,Systems,Computer security,21,"IEEE S&P (""Oakland"") 2024",IEEE Symposium on Security and Privacy,https://sp2024.ieee-security.org,May 20 – 23,"San Francisco, California, USA",1,"14 abr. 2023, 08:59",,2023-04-14 08:59:59,Confirmed,"Deadline (1 / 3): 14 Apr 2023, 8:59:59 am"
8,Systems,Computer security,21,"IEEE S&P (""Oakland"") 2024",IEEE Symposium on Security and Privacy,https://sp2024.ieee-security.org,May 20 – 23,"San Francisco, California, USA",2,"04 ago. 2023, 08:59",,2023-08-04 08:59:59,Confirmed,"Deadline (2 / 3): 4 Aug 2023, 8:59:59 am"
8,Systems,Computer security,21,"IEEE S&P (""Oakland"") 2024",IEEE Symposium on Security and Privacy,https://sp2024.ieee-security.org,May 20 – 23,"San Francisco, California, USA",3,"07 dez. 2023, 08:59",,2023-12-07 08:59:59,Confirmed,"Deadline (3 / 3): 7 Dec 2023, 8:59:59 am"
8,Systems,Computer security,22,USENIX Security 2024,USENIX Security Symposium,https://www.usenix.org/conference/usenixsecurity24,August 14–16,"Philadelphia, PA, USA",1,"07 jun. 2023, 08:59",,2023-06-07 08:59:59,Confirmed,"Deadline (1 / 3): 7 Jun 2023, 8:59:59 am"
8,Systems,Computer security,22,USENIX Security 2024,USENIX Security Symposium,https://www.usenix.org/conference/usenixsecurity24,August 14–16,"Philadelphia, PA, USA",2,"18 out. 2023, 08:59",,2023-10-18 08:59:59,Confirmed,"Deadline (2 / 3): 18 Oct 2023, 8:59:59 am"
8,Systems,Computer security,22,USENIX Security 2024,USENIX Security Symposium,https://www.usenix.org/conference/usenixsecurity24,August 14–16,"Philadelphia, PA, USA",3,"09 fev. 2024, 08:59",,2024-02-09 08:59:59,Confirmed,"Deadline (3 / 3): 9 Feb 2024, 8:59:59 am"
8,Systems,Computer security,23,NDSS 2024,ISOC Network and Distributed System Security Symposium,https://www.ndss-symposium.org/ndss2024/,February 26 – March 1,"San Diego, CA, USA",1,"20 abr. 2023, 08:59",,2023-04-20 08:59:59,Confirmed,"Deadline (1 / 2): 20 Apr 2023, 8:59:59 am"
8,Systems,Computer security,23,NDSS 2024,ISOC Network and Distributed System Security Symposium,https://www.ndss-symposium.org/ndss2024/,February 26 – March 1,"San Diego, CA, USA",2,"29 jun. 2023, 08:59",,2023-06-29 08:59:59,Confirmed,"Deadline (2 / 2): 29 Jun 2023, 8:59:59 am"
9,Systems,Databases,24,SIGMOD 2024,ACM SIGMOD/PODS International Conference on Management of Data,https://2024.sigmod.org/index.shtml,June 11-16,"Santiago, Chile",1,"15 jan. 2023, 23:59",PST,2023-01-15 23:59:59,Confirmed,"Deadline (1 / 4): 15 Jan 2023, 11:59 pm PST"
9,Systems,Databases,24,SIGMOD 2024,ACM SIGMOD/PODS International Conference on Management of Data,https://2024.sigmod.org/index.shtml,June 11-16,"Santiago, Chile",2,"15 abr. 2023, 23:59",PST,2023-04-15 23:59:59,Confirmed,"Deadline (2 / 4): 15 Apr 2023, 11:59 pm PST"
9,Systems,Databases,24,SIGMOD 2024,ACM SIGMOD/PODS International Conference on Management of Data,https://2024.sigmod.org/index.shtml,June 11-16,"Santiago, Chile",3,"15 jul. 2023, 23:59",PST,2023-07-15 23:59:59,Confirmed,"Deadline (3 / 4): 15 Jul 2023, 11:59 pm PST"
9,Systems,Databases,24,SIGMOD 2024,ACM SIGMOD/PODS International Conference on Management of Data,https://2024.sigmod.org/index.shtml,June 11-16,"Santiago, Chile",4,"15 out. 2023, 23:59",PST,2023-10-15 23:59:59,Confirmed,"Deadline (4 / 4): 15 Oct 2023, 11:59 pm PST"
9,Systems,Databases,25,PODS 2024,ACM SIGMOD/PODS International Conference on Management of Data,https://2024.sigmod.org/index.shtml,June 11-16,"Santiago, Chile",1,"06 jan. 2023, 23:59",PST,2023-01-06 23:59:59,Confirmed,"Deadline (1 / 2): 6 Jan 2023, 11:59 pm PST"
9,Systems,Databases,25,PODS 2024,ACM SIGMOD/PODS International Conference on Management of Data,https://2024.sigmod.org/index.shtml,June 11-16,"Santiago, Chile",2,"04 dez. 2023, 23:59",PST,2023-12-04 23:59:59,Confirmed,"Deadline (2 / 2): 4 Dec 2023, 11:59 pm PST"
10,Systems,Design automation,26,DAC 2024,Design Automation Conference,,,,1,"01 nov. 2023, 23:59",,2023-11-01 23:59:59,TBD,TBD (probably Nov 2023)
10,Systems,Design automation,27,ICCAD 2024,IEEE/ACM International Conference on Computer-Aided Design,,,,1,"01 mai. 2024, 23:59",,2024-05-01 23:59:59,TBD,TBD (probably May 2024)
11,Systems,Embedded & real-time systems,28,EMSOFT 2024,ACM SIGBED International Conference on Embedded Software (EMSOFT),,,,1,"01 mar. 2024, 23:59",,2024-03-01 23:59:59,TBD,TBD (probably Mar 2024)
11,Systems,Embedded & real-time systems,29,RTAS 2024,IEEE Real-Time and Embedded Technology and Applications Symposium,,,,1,"01 out. 2023, 23:59",,2023-10-01 23:59:59,TBD,TBD (probably Oct 2023)
11,Systems,Embedded & real-time systems,30,RTSS 2024,IEEE Real-Time Systems Symposium (RTSS),,,,1,"01 mai. 2024, 23:59",,2024-05-01 23:59:59,TBD,TBD (probably May 2024)
12,Systems,High-performance computing,31,HPDC 2024,International Symposium on High-Performance Parallel and Distributed Computing,,,,1,"01 jan. 2024, 23:59",,2024-01-01 23:59:59,TBD,TBD (probably Jan 2024)
12,Systems,High-performance computing,32,ICS 2024,International Conference on Supercomputing,,,,1,"01 jan. 2024, 23:59",,2024-01-01 23:59:59,TBD,TBD (probably Jan 2024)
12,Systems,High-performance computing,33,SC 2024,"The International Conference for High Performance Computing, Networking, Storage, and Analysis",,,,1,"01 mar. 2024, 23:59",,2024-03-01 23:59:59,TBD,TBD (probably Mar 2024)
13,Systems,Mobile computing,34,Mobicom 2024,Annual International Conference On Mobile Computing And Networking,,,,1,"01 ago. 2023, 23:59",,2023-08-01 23:59:00,TBD,TBD (probably Aug 2023)
13,Systems,Mobile computing,34,Mobicom 2024,Annual International Conference On Mobile Computing And Networking,,,,2,"01 mar. 2024, 23:59",,2024-03-01 23:59:59,TBD,TBD (probably Mar 2024)
13,Systems,Mobile computing,35,MobiSys 2024,"ACM International Conference on Mobile Systems, Applications, and Services",,,,1,"01 dez. 2023, 23:59",,2023-12-01 23:59:00,TBD,TBD (probably Dec 2023)
13,Systems,Mobile computing,36,SenSys 2023,ACM Conference on Embedded Networked Sensor Systems,http://sensys.acm.org/2023/,November 13 – 25,"Istanbul, Turkey",1,"22 jun. 2023, 23:59",AoE,2023-06-22 23:59:59,Confirmed,"Deadline: 22 Jun 2023, 23:59 AoE"
14,Systems,Measurement & perf. analysis,37,IMC 2024,Internet Measurement Conference (IMC),,,,1,"01 mai. 2024, 23:59",,2024-05-01 23:59:59,TBD,TBD (probably May 2024)
14,Systems,Measurement & perf. analysis,38,SIGMETRICS 2024,ACM SIGMETRICS,,,,1,"01 ago. 2024, 23:59",,2024-08-01 23:59:00,TBD,TBD (probably Aug 2024)
14,Systems,Measurement & perf. analysis,38,SIGMETRICS 2024,ACM SIGMETRICS,,,,2,"01 out. 2024, 23:59",,2024-10-01 23:59:59,TBD,TBD (probably Oct 2024)
14,Systems,Measurement & perf. analysis,38,SIGMETRICS 2024,ACM SIGMETRICS,,,,3,"01 jan. 2024, 23:59",,2024-01-01 23:59:59,TBD,TBD (probably Jan 2024)
15,Systems,Operating systems,39,OSDI 2024,USENIX Symposium on Operating Systems Design and Implementation,https://www.usenix.org/conference/osdi24,July 10-14,"Santa Clara, CA, USA",1,"30 nov. 2023, 05:59",EST,2023-11-30 05:59:59,Confirmed,"Deadline: 30 Nov 2023, 5:59 EST"
15,Systems,Operating systems,40,SOSP 2024,ACM Symposium on Operating Systems Principles,,,,1,"01 abr. 2024, 23:59",,2024-04-01 23:59:59,TBD,TBD (probably Apr 2024)
16,Systems,Programming languages,41,PLDI 2024,ACM SIGPLAN Conference on Programming Language Design and Implementation,,,,1,"01 nov. 2023, 23:59",,2023-11-01 23:59:59,TBD,TBD (probably Nov 2023)
16,Systems,Programming languages,42,POPL 2024,ACM SIGPLAN Symposium on Principles of Programming Languages,https://popl24.sigplan.org,January 17-19,"London, UK",1,"11 jul. 2023, 23:59",AoE,2023-07-11 23:59:59,Confirmed,"Deadline: 11 Jul 2023, AoE"
16,Systems,Programming languages,43,ICFP 2024,ACM SIGPLAN International Conference on Functional Programming,,,,1,"01 mar. 2024, 23:59",,2024-03-01 23:59:59,TBD,TBD (probably Mar 2024)
16,Systems,Programming languages,44,OOPSLA 2024,"Object-oriented Programming, Systems, Languages, and Applications",,,,1,"27 out. 2023, 23:59",,2023-10-27 23:59:59,Confirmed,Deadline (1 / 2): 27 Oct 2023
16,Systems,Programming languages,44,OOPSLA 2024,"Object-oriented Programming, Systems, Languages, and Applications",,,,2,"05 abr. 2024, 23:59",,2024-04-05 23:59:59,Confirmed,Deadline (2 / 2): 5 Apr 2024
17,Systems,Software engineering,45,FSE 2024,Foundations of Software Engineering,https://conf.researchr.org/home/fse-2024,July 15-19,"Porto de Galinhas, Brazil",1,"21 set. 2023, 05:59",EST,2023-09-21 05:59:59,Confirmed,"Deadline: 21 Sep 2023, 5:59 EST"
17,Systems,Software engineering,46,ICSE 2024,International Conference on Software Engineering,https://conf.researchr.org/home/icse-2024,April 14-20,"Lisbon, Portugal",1,"29 mar. 2023, 23:59",,2023-03-29 23:59:59,Confirmed,Deadline (1 / 2): 29 Mar 2023
17,Systems,Software engineering,46,ICSE 2024,International Conference on Software Engineering,https://conf.researchr.org/home/icse-2024,April 14-20,"Lisbon, Portugal",2,"01 ago. 2023, 23:59",,2023-08-01 23:59:59,Confirmed,Deadline (2 / 2): 1 Aug 2023
17,Systems,Software engineering,47,ASE 2024,IEEE/ACM International Conference on Automated Software Engineering,https://conf.researchr.org/home/ase-2023,September 11-15,"Kirchberg, Luxembourg",1,"01 mar. 2024, 23:59",,2024-03-01 23:59:59,TBD,TBD (probably Mar 2024)
17,Systems,Software engineering,48,ISSTA 2024,ACM SIGSOFT International Symposium on Software Testing and Analysis,https://conf.researchr.org/home/issta-2024,September 16-20,"Vienna, Australia",1,"15 dez. 2023, 23:59",,2023-12-15 23:59:59,Confirmed,Deadline (1 / 2): 15 Dec 2023
17,Systems,Software engineering,48,ISSTA 2024,ACM SIGSOFT International Symposium on Software Testing and Analysis,https://conf.researchr.org/home/issta-2024,September 16-20,"Vienna, Australia",2,"12 abr. 2024, 23:59",,2024-04-12 23:59:59,Confirmed,Deadline (2 / 2): 12 Apr 2024
18,Theory,Algorithms & complexity,49,FOCS 2024,Annual Symposium on Foundations of Computer Science,,,,1,01 mar. 2024 23:59,,2024-03-01 23:59:59,TBD,TBD (probably Mar 2024)
18,Theory,Algorithms & complexity,50,SODA 2024,ACM-SIAM Symposium on Discrete Algorithms (SODA),https://www.siam.org/conferences/cm/conference/soda24,January 7-10,"Alexandria, VA, USA",1,09 jul. 2023 23:59,AoE,2023-07-09 23:59:59,Confirmed,"Deadline: 09 Jul 2023, 23:59 AoE"
18,Theory,Algorithms & complexity,51,STOC 2024,Annual ACM Symposium on Theory of Computing,,,,1,"01 nov. 2023, 23:59",,2023-11-01 23:59:59,TBD,TBD (probably Nov 2023)
19,Theory,Cryptography,52,Crypto 2024,International Cryptology Conference,,,,1,"01 mar. 2024, 23:59",,2024-03-01 23:59:59,TBD,TBD (probably Mar 2024)
19,Theory,Cryptography,53,EuroCrypt 2024,International Conference on the Theory and Applications of Cryptographic Techniques,,,,1,"01 out. 2023, 23:59",,2023-10-01 23:59:59,TBD,TBD (probably Oct 2023)
20,Theory,Logic & verification,54,CAV 2024,International Conference on Computer Aided Verification,,,,1,"01 fev. 2024, 23:59",,2024-02-01 23:59:59,TBD,TBD (probably Feb 2024)
20,Theory,Logic & verification,55,LICS 2024,Annual ACM/IEEE Symposium on Logic in Computer Science,,,,1,"1 jan. 2024, 23:59",,2024-01-01 23:59:59,TBD,TBD (probably Jan 2024)
21,Interdisciplinary Areas,Comp. bio & bioinformatics,56,ISMB 2024,Intelligent Systems for Molecular Biology,,,,1,"1 jan. 2024, 23:59",,2024-01-01 23:59:00,TBD,TBD (probably Jan 2024)
21,Interdisciplinary Areas,Comp. bio & bioinformatics,57,RECOMB 2024,Annual International Conference on Research in Computational Molecular Biology,https://recomb.org/recomb2024/,April 29 - May 2,"Boston, MA, USA",1,"1 out. 2023, 23:59",,2023-10-01 23:59:00,TBD,TBD (probably Oct 2023)
22,Interdisciplinary Areas,Computer graphics,58,SIGGRAPH 2024,ACM SIGGRAPH,,,,1,"1 jan. 2024, 23:59",,2024-01-01 23:59:00,TBD,TBD (probably Jan 2024)
22,Interdisciplinary Areas,Computer graphics,59,SIGGRAPH Asia 2024,ACM SIGGRAPH Conference and Exhibition on Computer Graphics and Interactive Techniques in Asia,,,,1,"1 mai. 2024, 23:59",,2024-05-01 23:59:59,TBD,TBD (probably May 2024)
22,Interdisciplinary Areas,Computer graphics,60,EUROGRAPHICS 2024,Annual Conference of the European Association for Computer Graphics,,,,1,"1 set. 2024, 23:59",,2024-09-01 23:59:59,TBD,TBD (probably Sep 2024)
23,Interdisciplinary Areas,Computer science education,61,SIGCSE 2024,SIGCSE Technical Symposium,https://sigcse2024.sigcse.org,March 20-23,"Portland, OR, USA",1,"11 ago. 2024, 23:59",,2024-08-11 23:59:59,Confirmed,Deadline: 11 Aug 2023 23:59
24,Interdisciplinary Areas,Economics & computation,62,EC'24,ACM Conference on Economics and Computation,,,,1,"2 jan. 2024, 00:00",,2024-01-02 00:00:29,TBD,TBD (probably Jan 2024)
24,Interdisciplinary Areas,Economics & computation,63,WINE 2023,Conference on Web and Internet Economics,https://wine2023.shanghaitech.edu.cn,December 4-8,"Shangai, China",1,"7 jul. 2023, 23:59",,2023-07-07 23:59:00,Confirmed,"Deadline: 07 Jul 2023, 23:59"
25,Interdisciplinary Areas,Human-computer interaction,64,CHI 2024,ACM CHI Conference on Human Factors in Computing Systems,https://chi2024.acm.org,May 11-16,"Oʻahu, Hawaii, USA",1,"7 set. 2023, 23:59",,2023-09-07 23:59:59,Confirmed,Deadine: 07 Sep 2023
25,Interdisciplinary Areas,Human-computer interaction,65,UbiComp / ISWC 2024,"Annual International Symposium on Wearable Computers (ISWC), held in conjunction with ACM International Joint Conference on Pervasive and Ubiquitous Computing",,,,1,"1 mai. 2024, 23:59",,2024-05-01 23:59:59,TBD,TBD (probably May 2024)
25,Interdisciplinary Areas,Human-computer interaction,66,UIST 2024,ACM Symposium on User Interface Software and Technology,,,,1,"1 mar. 2024, 23:59",,2024-03-01 23:59:59,TBD,TBD (probably Mar 2024)
26,Interdisciplinary Areas,Robotics,67,ICRA 2024,IEEE International Conference on Robotics and Automation,http://ieee-icra.org,May 13-17,"Yokohama, Japan",1,"15 jul. 2023, 23:59",,2023-07-15 23:59:00,Confirmed,Deadline: 15 Sep 2023 23:59
26,Interdisciplinary Areas,Robotics,68,IROS 2024,IEEE/RSJ International Conference on Intelligent Robots and Systems,http://iros2024-abudhabi.org,Oct 13-17,"Abu Dhabi, UAE",1,"1 mar. 2024, 23:59",,2024-03-01 23:59:59,TBD,TBD (probably Mar 2024)
26,Interdisciplinary Areas,Robotics,69,RSS 2024,Robotics: Science and Systems Conference,,,,1,"1 fev. 2024, 23:59",,2024-02-01 23:59:59,TBD,TBD (probably Feb 2024)
27,Interdisciplinary Areas,Visualization,70,VIS 2024,IEEE Visualization Conference,,,,1,"1 mar. 2024, 23:59",,2024-03-01 23:59:00,TBD,TBD (probably Mar 2024)
27,Interdisciplinary Areas,Visualization,71,VR 2024,IEEE Conference on Virtual Reality and 3D User Interfaces,,Mar 16-20,"Orlando, FL, 2024",1,"1 out. 2023, 23:59",,2023-10-01 23:59:59,TBD,TBD (probably Oct 2023)